{
  "schema_version": 1,
  "id": "Evidence.CovalentCombination@1",
  "claims": [
    {
      "id": "R1",
      "subject_role": "product",
      "subject": "product",
      "predicate": "forms",
      "sources": [
        "S1"
      ]
    },
    {
      "id": "R2",
      "subject_role": "reactant",
      "subject": "element",
      "predicate": "disappears",
      "sources": [
        "S1"
      ]
    }
  ],
  "sources": [
    {
      "id": "S1",
      "title": "Occurrence, Preparation, and Compounds of Hydrogen",
      "publisher": "OpenStax",
      "url": "https://openstax.org/books/chemistry-atoms-first/pages/18-5-occurrence-preparation-and-compounds-of-hydrogen",
      "supports": [
        "R1",
        "R2"
      ]
    }
  ]
}
