{
  "schema_version": 1,
  "id": "Evidence.AcidBicarbonateGasEvolution@1",
  "claims": [
    {"id": "R1", "subject_role": "gas", "subject": "carbon dioxide", "predicate": "evolves", "sources": ["S1"]},
    {"id": "R2", "subject_role": "reactant", "subject": "strong acid", "predicate": "disappears", "sources": ["S1"]}
  ],
  "sources": [
    {
      "id": "S1",
      "title": "Gas Evolution Reactions",
      "publisher": "Chemistry LibreTexts",
      "url": "https://chem.libretexts.org/Bookshelves/General_Chemistry/Map%3A_Chemistry_-_The_Central_Science_(Brown_et_al.)/04%3A_Reactions_in_Aqueous_Solution/4.05%3A_Gas-Evolution_Reactions",
      "supports": ["R1", "R2"]
    }
  ]
}
