{
  "schema_version": 1,
  "id": "Evidence.AlkaliWaterCaesium@1",
  "claims": [
    {
      "id": "R1",
      "subject_role": "gas",
      "subject": "hydrogen",
      "predicate": "evolves",
      "sources": [
        "S1"
      ]
    },
    {
      "id": "R2",
      "subject_role": "reactant",
      "subject": "alkali metal",
      "predicate": "disappears",
      "sources": [
        "S1"
      ]
    }
  ],
  "sources": [
    {
      "id": "S1",
      "title": "Reactions of Group 1 Elements with Water",
      "publisher": "Chemistry LibreTexts",
      "url": "https://chem.libretexts.org/Bookshelves/Inorganic_Chemistry/Supplemental_Modules_and_Websites_(Inorganic_Chemistry)/Descriptive_Chemistry/Elements_Organized_by_Block/1_s-Block_Elements/Group_1%3A_The_Alkali_Metals/2Reactions_of_the_Group_1_Elements/Reactions_of_Group_1_Elements_with_Water",
      "supports": [
        "R1",
        "R2"
      ]
    }
  ]
}
