{
    "schema_version":  1,
    "id":  "Evidence.OxygenReaction@1",
    "claims":  [
                   {
                       "id":  "R1",
                       "subject_role":  "product",
                       "subject":  "oxide",
                       "predicate":  "forms",
                       "sources":  [
                                       "S1"
                                   ]
                   },
                   {
                       "id":  "R2",
                       "subject_role":  "reactant",
                       "subject":  "element",
                       "predicate":  "disappears",
                       "sources":  [
                                       "S1"
                                   ]
                   }
               ],
    "sources":  [
                    {
                        "id":  "S1",
                        "title":  "Occurrence, Preparation, and Compounds of Oxygen",
                        "publisher":  "OpenStax",
                        "url":  "https://openstax.org/books/chemistry-atoms-first-2e/pages/18-9-occurrence-preparation-and-compounds-of-oxygen",
                        "supports":  [
                                         "R1",
                                         "R2"
                                     ]
                    }
                ]
}