{
  "schema_version": 1,
  "id": "Evidence.SilverHalidePrecipitation@1",
  "claims": [
    {"id": "R1", "subject_role": "product", "subject": "silver halide precipitate", "predicate": "forms", "sources": ["S1"]},
    {"id": "R2", "subject_role": "product", "subject": "silver halide precipitate", "predicate": "colour", "sources": ["S1"]}
  ],
  "sources": [
    {
      "id": "S1",
      "title": "Precipitation Reactions",
      "publisher": "Chemistry LibreTexts",
      "url": "https://chem.libretexts.org/Bookshelves/General_Chemistry/Map%3A_Chemistry_-_The_Central_Science_(Brown_et_al.)/04%3A_Reactions_in_Aqueous_Solution/4.02%3A_Precipitation_Reactions",
      "supports": ["R1", "R2"]
    }
  ]
}
