{
  "schema_version": 1,
  "id": "Evidence.CopperHydroxidePrecipitation@1",
  "claims": [
    {
      "id": "R1",
      "subject_role": "product",
      "subject": "copper hydroxide",
      "predicate": "forms",
      "sources": [
        "S1"
      ]
    }
  ],
  "sources": [
    {
      "id": "S1",
      "title": "Precipitation reactions",
      "publisher": "OpenStax",
      "url": "https://openstax.org/books/chemistry-2e/pages/4-2-classifying-chemical-reactions",
      "supports": [
        "R1"
      ]
    }
  ]
}
